{
  "artifact_id": "QDP_V10_6_FORK_INTAKE_TEMPLATE_M04",
  "module_id": "M04",
  "date": "",
  "requestor": "",
  "branch_or_model_tag": "",
  "change_types": [],
  "model_classification": "",
  "candidate_H_mod_symbolic": "",
  "candidate_H_mod_physical_interpretation": "",
  "claimed_effect": "",
  "declared_family_class": "",
  "declared_likely_bath_class_raw": "",
  "declared_likely_bath_class_other_text": "",
  "bath_classification_consistent_with_glossary_asserted": false,
  "primary_observable": "",
  "secondary_observable": "",
  "accessible_platform_or_device_class": "",
  "minimal_discriminant_measurement": "",
  "cross_scale_claim_present": false,
  "effective_mapping_attached": false,
  "invariant_preserved": "",
  "reduction_limit": "",
  "count_new_free_parameters": 0,
  "new_free_parameters": [],
  "parameter_constraints": {},
  "independent_constraint_source_per_parameter": {},
  "exact_falsifier": "",
  "does_increase_falsifiable_surface_area": false,
  "relevant_nuisance_controls_list": [],
  "validation_ladder_plan": {
    "L0_baseline_pipeline_reproduced": false,
    "L1_reduction_limit_verified": false,
    "L2_convergence_plan_defined": false,
    "L3_stability_criterion_defined": false,
    "L4_instrument_facing_comparison_path_defined": false
  },
  "notes": ""
}