{
  "artifact_id": "QDP_V10_6_FORK_INTAKE_TEMPLATE_M04",
  "module_id": "M04",
  "date": "2026-03-15",
  "requestor": "workspace",
  "branch_or_model_tag": "M04_MISSING_FALSIFIER",
  "change_types": [
    "OBSERVABLE"
  ],
  "model_classification": "EXAMPLE",
  "candidate_H_mod_symbolic": "delta observable",
  "candidate_H_mod_physical_interpretation": "Observable remapping only.",
  "claimed_effect": "Observable aliasing correction.",
  "declared_family_class": "MARKOVIAN_RESERVOIR",
  "declared_likely_bath_class_raw": "MARKOVIAN_RESERVOIR",
  "declared_likely_bath_class_other_text": "",
  "bath_classification_consistent_with_glossary_asserted": true,
  "primary_observable": "quality factor",
  "secondary_observable": "frequency shift",
  "accessible_platform_or_device_class": "resonator",
  "minimal_discriminant_measurement": "power sweep",
  "cross_scale_claim_present": false,
  "effective_mapping_attached": false,
  "invariant_preserved": "baseline normalization",
  "reduction_limit": "Observable remapping reduces to baseline at zero correction.",
  "count_new_free_parameters": 0,
  "new_free_parameters": [],
  "parameter_constraints": {},
  "independent_constraint_source_per_parameter": {},
  "exact_falsifier": "",
  "does_increase_falsifiable_surface_area": true,
  "relevant_nuisance_controls_list": [
    "readout_gain"
  ],
  "validation_ladder_plan": {
    "L0_baseline_pipeline_reproduced": true,
    "L1_reduction_limit_verified": false,
    "L2_convergence_plan_defined": false,
    "L3_stability_criterion_defined": false,
    "L4_instrument_facing_comparison_path_defined": false
  },
  "notes": "Missing falsifier control."
}